{"asof_date":"2026-04-21","cash_policy":"clip_to_available","cash_summary":{"INTRADAY":{"capital_usd":100.0,"cash_retained_usd":100.0,"cash_source":"positions_snapshot","cash_used_usd":0},"LONG_TERM":{"capital_usd":100.0,"cash_retained_usd":100.0,"cash_source":"positions_snapshot","cash_used_usd":0}},"constraints":[],"execution_date":"2026-04-22","execution_hour":"1950","horizon":"INTRADAY","policy_id":"policy.topk.net_after_fees.v1","policy_version":"1","reader_min_version":"1.0.0","recommendations":[{"action":"SKIP","allow_fractional":true,"asof_date":"2026-04-21","asset_id":"V","broker_costs":{"balanz":{"commission_pct":0.006,"fee_one_way":5.0,"fee_round_trip":10.0,"min_usd":5.0},"generic_us":{"commission_pct":0.002,"fee_one_way":1.0,"fee_round_trip":2.0,"min_usd":1.0},"iol":{"commission_pct":0.005,"fee_one_way":5.0,"fee_round_trip":10.0,"min_usd":5.0}},"broker_selected":"generic_us","cash_available_usd":null,"cash_used_usd":0.0,"constraints":[],"currency":"USD","current_qty":0.0,"delta_qty":0.0,"execution_date":"2026-04-22","execution_hour":"1950","expected_return_gross_pct":0.006762,"expected_return_net_pct":-0.033238,"expected_return_net_usd":-1.6619,"expected_return_source":"calibrated","fees_estimated_usd":1.0,"fees_one_way":1.0,"fees_round_trip":2.0,"fx_rate_source":"native_usd","fx_rate_used":1.0,"horizon":"INTRADAY","lot_size":1,"min_capital_viable_usd":null,"min_notional_usd":0.0,"order_notional_ccy":0.0,"order_notional_usd":0.0,"order_qty":0.0,"order_side":null,"order_status":"NO_ORDER","order_type":"MARKET","policy_id":"policy.topk.net_after_fees.v1","policy_version":"1","price_source":"features.close","price_used":328.3,"qty_target":0.0,"reason":"model_score=0.995793 day=2026-04-21 | empirical_mean=0.006306 | empirical_hit=0.993243 | empirical_n=148 | oos_trade_mean=0.004581 | oos_trade_hit=1.000000 | oos_trade_n=75 | gross_pct=0.006762 | net_pct=-0.033238 | threshold=0.008000 | broker_cost_floor>edge | net<threshold","sizing_rule":"weights.normalized_pct","ticker":"V","time_in_force":"DAY","usd_target":0.0,"usd_target_effective":50.0,"weight":0.0},{"action":"SKIP","allow_fractional":true,"asof_date":"2026-04-21","asset_id":"MSFT","broker_costs":{"balanz":{"commission_pct":0.006,"fee_one_way":5.0,"fee_round_trip":10.0,"min_usd":5.0},"generic_us":{"commission_pct":0.002,"fee_one_way":1.0,"fee_round_trip":2.0,"min_usd":1.0},"iol":{"commission_pct":0.005,"fee_one_way":5.0,"fee_round_trip":10.0,"min_usd":5.0}},"broker_selected":"generic_us","cash_available_usd":null,"cash_used_usd":0.0,"constraints":[],"currency":"USD","current_qty":0.0,"delta_qty":0.0,"execution_date":"2026-04-22","execution_hour":"1950","expected_return_gross_pct":0.006249,"expected_return_net_pct":-0.033750999999999996,"expected_return_net_usd":-1.6875499999999999,"expected_return_source":"calibrated","fees_estimated_usd":1.0,"fees_one_way":1.0,"fees_round_trip":2.0,"fx_rate_source":"native_usd","fx_rate_used":1.0,"horizon":"INTRADAY","lot_size":1,"min_capital_viable_usd":null,"min_notional_usd":0.0,"order_notional_ccy":0.0,"order_notional_usd":0.0,"order_qty":0.0,"order_side":null,"order_status":"NO_ORDER","order_type":"MARKET","policy_id":"policy.topk.net_after_fees.v1","policy_version":"1","price_source":"features.close","price_used":459.86,"qty_target":0.0,"reason":"model_score=0.986990 day=2026-04-21 | empirical_mean=0.005673 | empirical_hit=1.000000 | empirical_n=135 | oos_trade_mean=0.004468 | oos_trade_hit=1.000000 | oos_trade_n=76 | gross_pct=0.006249 | net_pct=-0.033751 | threshold=0.008000 | broker_cost_floor>edge | net<threshold","sizing_rule":"weights.normalized_pct","ticker":"MSFT","time_in_force":"DAY","usd_target":0.0,"usd_target_effective":50.0,"weight":0.0},{"action":"SKIP","allow_fractional":true,"asof_date":"2026-04-21","asset_id":"JPM","broker_costs":{"balanz":{"commission_pct":0.006,"fee_one_way":0.0,"fee_round_trip":0.0,"min_usd":5.0},"generic_us":{"commission_pct":0.002,"fee_one_way":0.0,"fee_round_trip":0.0,"min_usd":1.0},"iol":{"commission_pct":0.005,"fee_one_way":0.0,"fee_round_trip":0.0,"min_usd":5.0}},"broker_selected":"generic_us","cash_available_usd":null,"cash_used_usd":0.0,"constraints":[],"currency":"USD","current_qty":0.0,"delta_qty":0.0,"execution_date":"2026-04-22","execution_hour":"1950","expected_return_gross_pct":0.00886,"expected_return_net_pct":0.0,"expected_return_net_usd":0.0,"expected_return_source":"calibrated","fees_estimated_usd":0.0,"fees_one_way":0.0,"fees_round_trip":0.0,"fx_rate_source":"native_usd","fx_rate_used":1.0,"horizon":"INTRADAY","lot_size":1,"min_capital_viable_usd":null,"min_notional_usd":0.0,"order_notional_ccy":0.0,"order_notional_usd":0.0,"order_qty":0.0,"order_side":null,"order_status":"NO_ORDER","order_type":"MARKET","policy_id":"policy.topk.net_after_fees.v1","policy_version":"1","price_source":"features.close","price_used":312.47,"qty_target":0.0,"reason":"model_score=0.986599 day=2026-04-21 | empirical_mean=0.008709 | empirical_hit=1.000000 | empirical_n=169 | oos_trade_mean=0.007887 | oos_trade_hit=1.000000 | oos_trade_n=76 | gross_pct=0.008860 | net_pct=0.000000 | threshold=0.008000 | broker_cost_floor>edge | net<threshold","sizing_rule":"weights.normalized_pct","ticker":"JPM","time_in_force":"DAY","usd_target":0.0,"usd_target_effective":0.0,"weight":0.0}],"run_id":"20260422-1950","schema_version":"1.0.0","sizing_rule":"weights.normalized_pct"}