{"asof_date":"2026-04-21","cash_policy":"clip_to_available","cash_summary":{"INTRADAY":{"capital_usd":12.665525303675622,"cash_retained_usd":12.665525303675622,"cash_source":"positions_snapshot","cash_used_usd":0},"LONG_TERM":{"capital_usd":12.665525303675622,"cash_retained_usd":12.665525303675622,"cash_source":"positions_snapshot","cash_used_usd":0}},"constraints":[],"execution_date":"2026-04-22","execution_hour":"1835","horizon":"MIXED","policy_id":"policy.topk.net_after_fees.v1","policy_version":"1","reader_min_version":"1.0.0","recommendations":[{"action":"EXIT","allow_fractional":true,"asof_date":"2026-04-21","asset_id":"JPM","broker_costs":{"balanz":{"commission_pct":0.006,"fee_one_way":5.0,"fee_round_trip":10.0,"min_usd":5.0},"generic_us":{"commission_pct":0.002,"fee_one_way":1.0,"fee_round_trip":2.0,"min_usd":1.0},"iol":{"commission_pct":0.005,"fee_one_way":5.0,"fee_round_trip":10.0,"min_usd":5.0}},"broker_selected":"generic_us","cash_available_usd":null,"cash_used_usd":0.0,"constraints":[],"currency":"USD","current_qty":0.0,"delta_qty":0.0,"execution_date":"2026-04-22","execution_hour":"1835","expected_return_gross_pct":0.006973,"expected_return_net_pct":0.0,"expected_return_net_usd":0.0,"expected_return_source":"calibrated","fees_estimated_usd":0.0,"fees_one_way":0.0,"fees_round_trip":0.0,"fx_rate_source":"native_usd","fx_rate_used":1.0,"horizon":"INTRADAY","lot_size":1,"min_notional_usd":0.0,"order_notional_ccy":0.0,"order_notional_usd":0.0,"order_qty":0.0,"order_side":null,"order_status":"NO_ORDER","order_type":"MARKET","policy_id":"policy.topk.net_after_fees.v1","policy_version":"1","price_source":"features.close","price_used":312.47,"qty_target":0.0,"reason":"model_score=0.837475 day=2026-04-21 | empirical_mean=0.008248 | empirical_hit=0.884298 | empirical_n=121 | gross_pct=0.006973 | net_pct=-0.013027 | threshold=0.008000 | net<threshold","sizing_rule":"weights.normalized_pct","ticker":"JPM","time_in_force":"DAY","usd_target":0.0,"usd_target_effective":0.0,"weight":0.0},{"action":"SELL","allow_fractional":true,"asof_date":"2026-04-21","asset_id":"NVDA","broker_costs":{"generic_us":{"commission_pct":0.002,"fee_one_way":1.0,"fee_round_trip":2.0,"min_usd":1.0}},"broker_selected":"generic_us","cash_available_usd":null,"cash_used_usd":0.0,"constraints":[],"currency":"USD","current_qty":0.4582208811487106,"delta_qty":-0.4582208811487106,"execution_date":"2026-04-22","execution_hour":"1835","expected_return_gross_pct":0.0,"expected_return_net_pct":-0.011718593259742338,"expected_return_net_usd":-1.0,"expected_return_source":"position_pnl","fees_estimated_usd":1.0,"fees_one_way":1.0,"fees_round_trip":2.0,"fx_rate_source":"native_usd","fx_rate_used":1.0,"horizon":"INTRADAY","lot_size":1,"min_notional_usd":50.0,"order_notional_ccy":85.33447469632438,"order_notional_usd":85.33447469632438,"order_qty":0.4582208811487106,"order_side":"SELL","order_status":"READY","order_type":"MARKET","policy_id":"policy.topk.net_after_fees.v1","policy_version":"1","price_source":"features.close","price_used":186.23,"qty_target":0.0,"reason":"gross_pct=0.000000 | net_pct=-0.011719 | threshold=0.008000","sizing_rule":"weights.normalized_pct","ticker":"NVDA","time_in_force":"DAY","usd_target":0.0,"usd_target_effective":85.33447469632438,"weight":0.0},{"action":"SELL","allow_fractional":true,"asof_date":"2026-04-21","asset_id":"NVDA","broker_costs":{"generic_us":{"commission_pct":0.002,"fee_one_way":1.0,"fee_round_trip":2.0,"min_usd":1.0}},"broker_selected":"generic_us","cash_available_usd":null,"cash_used_usd":0.0,"constraints":[],"currency":"USD","current_qty":0.4582208811487106,"delta_qty":-0.4582208811487106,"execution_date":"2026-04-22","execution_hour":"1835","expected_return_gross_pct":0.0,"expected_return_net_pct":-0.011718593259742338,"expected_return_net_usd":-1.0,"expected_return_source":"position_pnl","fees_estimated_usd":1.0,"fees_one_way":1.0,"fees_round_trip":2.0,"fx_rate_source":"native_usd","fx_rate_used":1.0,"horizon":"LONG_TERM","lot_size":1,"min_notional_usd":50.0,"order_notional_ccy":85.33447469632438,"order_notional_usd":85.33447469632438,"order_qty":0.4582208811487106,"order_side":"SELL","order_status":"READY","order_type":"MARKET","policy_id":"policy.topk.net_after_fees.v1","policy_version":"1","price_source":"features.close","price_used":186.23,"qty_target":0.0,"reason":"gross_pct=0.000000 | net_pct=-0.011719 | threshold=0.050000","sizing_rule":"weights.normalized_pct","ticker":"NVDA","time_in_force":"DAY","usd_target":0.0,"usd_target_effective":85.33447469632438,"weight":0.0}],"run_id":"20260422-1835","schema_version":"1.0.0","sizing_rule":"weights.normalized_pct"}